{
  "schema_version": "1.0.0",
  "record_type": "result",
  "id": "dq-bone-adverse-events-20wk-mixed",
  "name": "D+Q 20-week adverse-event aggregate result",
  "source_id": "nct-04313634",
  "study_id": "dq-postmenopausal-bone-rct",
  "outcome_id": "dq-bone-adverse-events-20wk",
  "finding_ids": [
    "dq-bone-rct-primary-null-subgroup-biomarker-signal"
  ],
  "intervention_ids": [
    "dasatinib-quercetin"
  ],
  "comparator": "Untreated control",
  "arm_details": "ClinicalTrials.gov adverseEventsModule eventGroups report D+Q and untreated-control aggregate counts for other adverse events, serious adverse events, and deaths from baseline to approximately 20 weeks. The comparative effect below applies only to the registry other adverse-event aggregate, where both compared arms have explicit participant counts.",
  "sample_size": 60,
  "group_values": [
    {
      "group_id": "EG000-other-ae",
      "group_label": "D+Q participants with other adverse events",
      "sample_size": 30,
      "statistic": "count",
      "value": 23,
      "unit": "participants affected"
    },
    {
      "group_id": "EG002-other-ae",
      "group_label": "Untreated-control participants with other adverse events",
      "sample_size": 30,
      "statistic": "count",
      "value": 5,
      "unit": "participants affected"
    },
    {
      "group_id": "EG000-serious-ae",
      "group_label": "D+Q participants with serious adverse events",
      "sample_size": 30,
      "statistic": "count",
      "value": 0,
      "unit": "participants affected"
    },
    {
      "group_id": "EG002-serious-ae",
      "group_label": "Untreated-control participants with serious adverse events",
      "sample_size": 30,
      "statistic": "count",
      "value": 0,
      "unit": "participants affected"
    },
    {
      "group_id": "EG000-deaths",
      "group_label": "D+Q deaths",
      "sample_size": 30,
      "statistic": "count",
      "value": 0,
      "unit": "participants affected"
    },
    {
      "group_id": "EG002-deaths",
      "group_label": "Untreated-control deaths",
      "sample_size": 30,
      "statistic": "count",
      "value": 0,
      "unit": "participants affected"
    }
  ],
  "result_type": "safety_event",
  "effect": {
    "measure": "risk_ratio",
    "value": 4.6,
    "ci_lower": 2.02,
    "ci_upper": 10.49,
    "standard_error": 0.42049,
    "unit": "risk ratio",
    "raw_text": "ClinicalTrials.gov adverseEventsModule eventGroups report otherNumAffected/otherNumAtRisk of 23/30 for D+Q and 5/30 for untreated control; risk ratio and approximate 95% CI were calculated from those arm counts using the log risk-ratio standard error."
  },
  "analysis": {
    "comparison": "D+Q versus untreated control",
    "method": "Risk ratio calculated from registry other adverse-event aggregate counts (23/30 divided by 5/30); standard error is on the log risk-ratio scale.",
    "effect_note": "The comparative effect applies only to participants affected by other adverse events in the ClinicalTrials.gov eventGroups aggregate. Serious adverse events and deaths are retained descriptively as explicit 0/30 counts in both compared arms."
  },
  "adverse_event": {
    "preferred_term": "Other adverse events",
    "term_source": "trial_registry",
    "seriousness": "non_serious",
    "severity": "not_reported",
    "relatedness": "not_reported",
    "event_specific_counts": [
      {
        "arm_id": "EG000-other-ae",
        "arm_label": "D+Q participants with other adverse events",
        "sample_size": 30,
        "count_status": "reported_count",
        "event_count": 23,
        "raw_value": "otherNumAffected=23; otherNumAtRisk=30",
        "interpretation": "The registry adverseEventsModule reports 23 D+Q participants affected by other adverse events among 30 at risk."
      },
      {
        "arm_id": "EG002-other-ae",
        "arm_label": "Untreated-control participants with other adverse events",
        "sample_size": 30,
        "count_status": "reported_count",
        "event_count": 5,
        "raw_value": "otherNumAffected=5; otherNumAtRisk=30",
        "interpretation": "The registry adverseEventsModule reports 5 untreated-control participants affected by other adverse events among 30 at risk."
      }
    ],
    "zero_handling": {
      "control_zero_status": "not_applicable",
      "supports_comparative_effect": true,
      "rationale": "Both compared arms have explicit nonzero other-adverse-event participant counts, so no blank-cell or zero-imputation rule is needed for this registry aggregate comparison."
    }
  },
  "direction": "mixed",
  "evidence_tier": "clinical_or_mortality",
  "confidence": "moderate",
  "maturity_status": "registry_extracted",
  "provenance": [
    {
      "source_id": "nct-04313634",
      "source_snapshot_id": "snapshot-nct-04313634-clinicaltrials-v2-2026-06-21",
      "text_snapshot_id": "text-snapshot-nct-04313634-clinicaltrials-v2-2026-06-21",
      "locator_type": "registry_record",
      "locator": "section:adverse-events eventGroups",
      "status": "registry_extracted",
      "note": "Posted aggregate adverse-event group counts."
    },
    {
      "source_id": "pmid-38956196",
      "source_snapshot_id": "snapshot-pmid-38956196-pubmed-efetch-2026-06-21",
      "locator_type": "abstract",
      "locator": "PubMed abstract serious adverse event sentence",
      "status": "abstract_extracted",
      "note": "Abstract reports no serious adverse events were observed."
    }
  ],
  "statement": "ClinicalTrials.gov registry extraction shows other adverse events were more common in the D+Q arm than untreated control (23/30 versus 5/30; calculated risk ratio 4.60), while serious adverse events and deaths were 0/30 in both compared arms.",
  "time_horizon": "Baseline to approximately 20 weeks",
  "caveats": [
    "The adverse_event preferred_term field preserves a ClinicalTrials.gov aggregate category, not an individual MedDRA preferred term.",
    "The calculated risk ratio and uncertainty apply only to the registry other-adverse-event aggregate, not to serious adverse events, deaths, or individual preferred-term rows.",
    "This aggregate record does not enumerate every adverse-event preferred term; term-specific extraction should remain separate for preferred-term safety synthesis.",
    "Safety interpretation should account for the open-label design and the source distinction between registry aggregate counts and publication table preferred-term rows."
  ],
  "tags": [
    "senolytics",
    "human",
    "randomized-trial",
    "bone",
    "safety",
    "adverse-events"
  ]
}
