{
  "schema_version": "1.0.0",
  "record_type": "result",
  "id": "dq-bone-gastrointestinal-reflux-20wk-descriptive",
  "name": "D+Q 20-week gastrointestinal reflux adverse-event result",
  "source_id": "pmid-38956196",
  "study_id": "dq-postmenopausal-bone-rct",
  "outcome_id": "dq-bone-adverse-events-20wk",
  "finding_ids": [
    "dq-bone-rct-primary-null-subgroup-biomarker-signal"
  ],
  "intervention_ids": [
    "dasatinib-quercetin"
  ],
  "comparator": "Untreated control",
  "arm_details": "Extended Data Table 1 reports the gastrointestinal reflux row with a blank control cell and 2 (7%) in the D+Q cell. The blank control cell is preserved as not reported or below-table-threshold ambiguity, not encoded as zero.",
  "sample_size": 60,
  "group_values": [
    {
      "group_id": "dq-gastrointestinal-reflux",
      "group_label": "D+Q gastrointestinal reflux",
      "sample_size": 30,
      "statistic": "count",
      "value": 2,
      "unit": "participants affected"
    },
    {
      "group_id": "dq-gastrointestinal-reflux-percent",
      "group_label": "D+Q gastrointestinal reflux",
      "sample_size": 30,
      "statistic": "percent",
      "value": 7,
      "unit": "percent of arm"
    }
  ],
  "result_type": "safety_event",
  "effect": {
    "measure": "descriptive",
    "raw_text": "Gastrointestinal reflux row in Extended Data Table 1: control cell blank; D+Q 2 (7%)."
  },
  "analysis": {
    "comparison": "D+Q versus untreated control",
    "effect_note": "No comparative gastrointestinal reflux effect was calculated because the control cell is blank in a table restricted to events reported in more than one participant for each group."
  },
  "adverse_event": {
    "preferred_term": "Gastrointestinal reflux",
    "term_source": "publication_table",
    "seriousness": "non_serious",
    "severity": "not_reported",
    "relatedness": "not_reported",
    "event_specific_counts": [
      {
        "arm_id": "control",
        "arm_label": "Untreated control",
        "sample_size": 30,
        "count_status": "not_reported_or_below_threshold",
        "raw_value": "",
        "interpretation": "The source table leaves the control gastrointestinal reflux cell blank under a threshold for adverse events reported in more than one participant; this is not encoded as zero."
      },
      {
        "arm_id": "dq",
        "arm_label": "D+Q",
        "sample_size": 30,
        "count_status": "reported_count",
        "event_count": 2,
        "percent": 7,
        "raw_value": "2 (7%)",
        "interpretation": "The source table reports gastrointestinal reflux in 2 D+Q participants, 7% of the arm."
      }
    ],
    "zero_handling": {
      "control_zero_status": "not_reported_or_below_threshold",
      "supports_comparative_effect": false,
      "rationale": "The retained table does not state whether the blank control cell means zero events or a count below the table's reporting threshold."
    }
  },
  "direction": "inconclusive",
  "evidence_tier": "clinical_or_mortality",
  "confidence": "moderate",
  "maturity_status": "full_text_extracted",
  "provenance": [
    {
      "source_id": "pmid-38956196",
      "source_snapshot_id": "snapshot-pmid-38956196-pmc-author-manuscript-2026-06-22",
      "text_snapshot_id": "text-snapshot-pmid-38956196-pmc-author-manuscript-2026-06-22",
      "locator_type": "table",
      "locator": "section:pmc-t2-extended-data-table-1",
      "status": "full_text_extracted",
      "note": "Extended Data Table 1 gastrointestinal reflux row reports a blank control cell and D+Q 2 (7%); the footnote says results are adverse events reported in more than one participant for each group."
    },
    {
      "source_id": "pmid-38956196",
      "source_snapshot_id": "snapshot-pmid-38956196-pmc-author-manuscript-2026-06-22",
      "text_snapshot_id": "text-snapshot-pmid-38956196-pmc-author-manuscript-2026-06-22",
      "locator_type": "full_text_section",
      "locator": "section:pmc-s6-safety-and-adverse-events",
      "status": "full_text_extracted",
      "note": "Safety paragraph identifies gastrointestinal complaints among prominent adverse events and states that no serious or severe adverse events related to D+Q administration occurred."
    }
  ],
  "statement": "In the D+Q postmenopausal bone RCT publication table, gastrointestinal reflux was reported for 2 of 30 D+Q participants (7%); the matching control cell was blank and is not treated as a zero count.",
  "time_horizon": "Baseline to approximately 20 weeks",
  "caveats": [
    "The publication table does not provide an explicit control gastrointestinal reflux count; the blank control cell is preserved as zero/not-reported ambiguity.",
    "No risk ratio, risk difference, confidence interval, standard error, or variance is available from this row without unsupported zero handling.",
    "The open-label design may affect subjective adverse-event reporting."
  ],
  "tags": [
    "senolytics",
    "human",
    "randomized-trial",
    "bone",
    "safety",
    "adverse-events",
    "gastrointestinal-reflux",
    "preferred-term",
    "full-text-extracted"
  ]
}
